{
  "chunk_id": "a3ada4ab4c1690173643dc5360ecd90607f59303020ac942293062d5ae1f28c4",
  "doc_id": "instructor:seg000012",
  "chunk_index": 0,
  "chunker_version": "v1.0.0",
  "source_hash": "e22d390698653b7caba80c8f22ffcd8f5a6f33ba2d5338da0664c13f3d1728d7",
  "license_class": "instructor_provided",
  "corpus_type": "asr_transcript",
  "trope_ids": [
    "LEX-0001",
    "SON-0003"
  ],
  "embedding_model": "sentence-transformers/all-MiniLM-L6-v2",
  "embedding_dim": 384,
  "vector": [
    0.0095539992826571,
    -0.02641899801638245,
    -0.020875998432567468,
    -0.12338799073565984,
    0.0909549931708265,
    0.057824995658326016,
    -0.01644599876518512,
    0.03910699706372946,
    0.014211998932920526,
    -0.02798899789850215,
    0.0494049962905248,
    -0.015694998821572447,
    -0.016617998752270848,
    -0.04003399699412752,
    0.022992998273616776,
    -0.005012999623608964,
    0.02755799793086292,
    -0.030685997696003324,
    0.006409999518718025,
    -0.045093996614207585,
    0.042525996807020704,
    0.009502999286486331,
    0.01670699874558846,
    0.02074599844232826,
    -0.05108199616461063,
    0.03958099702814011,
    0.1039429921956486,
    -0.0828049937827529,
    -0.08740199343759637,
    -0.07605199428978833,
    0.042525996807020704,
    0.006504999511585141,
    0.05449799590812713,
    0.0365109972586449,
    0.010641999200966805,
    0.014354998922183657,
    -0.008578999355863015,
    0.04389099670453242,
    -0.05709399571321168,
    -0.02131999839923062,
    0.01227799907813103,
    0.09104099316436937,
    -0.03863499709916862,
    -0.05453399590542414,
    -0.028467997862537398,
    0.04898599632198458,
    -0.01187699910823931,
    0.0669309949746203,
    -0.0946349928945211,
    0.05703399571771666,
    0.052300996073084464,
    -0.07169699461677476,
    0.00776199941720582,
    0.06144299538667575,
    0.004442999666406268,
    0.05052399620650694,
    0.12002299098831411,
    0.013843998960551065,
    -0.014169998936074011,
    -0.03896799707416599,
    0.032751997540881865,
    -0.009941999253524897,
    -0.009033999321700256,
    -0.0053199996005584855,
    0.032842997534049304,
    -0.0538909959537025,
    -0.07731799419473326,
    -0.12300499076441664,
    0.060578995451547456,
    0.003728999720015525,
    0.07631899426974117,
    -0.00045299996598740486,
    -0.03750699718386224,
    0.02415399818644542,
    -0.0038709997093537398,
    -0.06338499524086458,
    -0.04472999664153779,
    0.0892909932957646,
    0.017907998655413787,
    0.021043998419953528,
    -0.013976998950565027,
    -0.03485699738283216,
    0.04506299661653515,
    -0.005287999602961141,
    -0.038363997119516116,
    -0.006778999491012401,
    -0.04576799656360165,
    0.009604999278827867,
    0.05706999571501368,
    -0.0422549968273682,
    0.07219699457923326,
    -0.03374099746662478,
    0.007752999417881567,
    -0.042269996826241954,
    -0.011230999156742923,
    0.0023959998201011526,
    -0.021967998350576844,
    -0.03552299733282689,
    -0.034258997427731794,
    -0.041499996884055854,
    -0.07934999404216463,
    -0.013289999002147043,
    0.02027399847776743,
    0.04590899655301494,
    0.032703997544485844,
    0.12418999067544328,
    0.01610599879071334,
    -0.023061998268436048,
    0.09458999289789982,
    -0.05292499602623267,
    0.04894499632506298,
    -0.04827199637559384,
    0.017895998656314784,
    -0.09947999253074401,
    0.0454479965876282,
    -0.007997999399486234,
    -0.048904996328066296,
    0.08482499363108524,
    0.03867999709578989,
    0.0023149998261828746,
    -0.03767399717132338,
    -0.0021909998354931654,
    -0.008284999377937415,
    0.036628997249785106,
    0.04033399697160262,
    -0.03374699746617429,
    -0.027763997915395824,
    -0.02688999798101836,
    -0.06819299487986556,
    -0.029896997755243803,
    -0.0046699996493624295,
    0.03491999737810193,
    0.06672999498971198,
    -0.04085299693263455,
    0.027845997909239018,
    -0.022461998313485845,
    0.1048769921255211,
    -0.0024619998151456752,
    0.025376998094618925,
    -0.047311996447673504,
    -0.040970996923774754,
    0.010192999234679067,
    -0.019409998542639136,
    0.017854998659393186,
    -0.07893199407354931,
    0.03345699748794835,
    -0.04545799658687737,
    0.08704899346410068,
    -0.014578998905365067,
    0.05545399583634779,
    -0.0704999947066491,
    0.02167799837235091,
    -0.044879996630275344,
    -0.024606998152432828,
    0.0012429999066718416,
    -0.016024998796795063,
    0.01335499899726665,
    0.037784997162989165,
    0.03299099752293703,
    -0.004420999668058094,
    -0.06890599482633138,
    -0.04066599694667507,
    -0.009892999257203966,
    -0.10723399194855049,
    0.03800899714617058,
    -0.01211099909066989,
    -0.012700999046370925,
    0.04792999640127222,
    0.03375499746557362,
    0.011168999161398067,
    -0.05060599620035013,
    0.01568799882209803,
    0.017494998686423062,
    -0.04471499664266403,
    0.052727996041024024,
    0.025667998072769774,
    -0.09954199252608886,
    0.006162999537263523,
    -0.06391599520099552,
    0.05742799568813396,
    0.04078599693766511,
    -0.05577399581232123,
    -0.04471999664228862,
    0.00514799961347276,
    -0.012068999093823375,
    0.07708199421245285,
    0.037447997188292136,
    -0.014272998928340462,
    0.029180997809003222,
    -0.10270899228830102,
    0.01565999882420035,
    0.04378699671234105,
    -0.009043999320949426,
    -0.035892997305046186,
    0.028595997852926776,
    0.09898599256783501,
    0.010353999222590705,
    -0.05663699574752461,
    0.0730689945137609,
    -0.09493899287169587,
    0.02543099809056444,
    -0.029410997791734138,
    0.04703099646877183,
    -0.042930996776612086,
    0.06690499497657246,
    0.015174998860615603,
    -0.08727199344735717,
    -0.09975399251017127,
    -0.01597499880054921,
    0.06540799508897169,
    0.006419999517967195,
    0.003391999745318493,
    -0.011921999104860576,
    0.03729199720000508,
    0.01906999856816735,
    0.014167998936224176,
    -0.04976699626334476,
    0.060031995492617854,
    0.06888799482768289,
    -0.06576899506186673,
    0.11631399126679692,
    0.036513997258419646,
    -0.02466299814822818,
    -0.09624299277378764,
    0.03319599750754502,
    0.02817599788446163,
    -0.03010199773985179,
    -0.09049199320558994,
    0.05682899573310867,
    -0.02973299776755741,
    -0.0238409982099464,
    0.14381498920193958,
    0.10754499192519967,
    0.048200996380924725,
    -0.023015998271889864,
    0.032822997535550964,
    -0.11530199134278091,
    0.005383999595753174,
    -0.03839999711681312,
    -0.06497299512163279,
    -0.07999299399388625,
    0.026539998007297408,
    0.004512999661150459,
    0.008071999393930092,
    0.0425729968034918,
    -0.042759996789451284,
    -0.0624449953114426,
    -0.08977499325942442,
    -0.016939998728094124,
    0.038416997115536713,
    -0.007551999432973248,
    0.03240199756716091,
    -0.05968899551837132,
    -0.023708998219857357,
    -0.03870899709361248,
    -0.06309099526293897,
    0.09397499294407588,
    0.043065996766475885,
    -0.03849999710930482,
    -0.03871299709331215,
    -0.0028909997829350714,
    -0.07287899452802667,
    0.022025998346222028,
    -0.0654089950888966,
    -0.01872099859437132,
    -0.05179299611122662,
    -0.024250998179162375,
    -0.06727499494879174,
    -0.07948799403180318,
    -0.048826996333922776,
    -0.03436699741962283,
    -0.014902998881038177,
    0.0034859997382606913,
    0.07716699420607079,
    0.0410499969178432,
    -0.012780999040364286,
    0.036686997245430286,
    -0.03481599738591057,
    0.07320499450354961,
    0.027769997914945325,
    -0.06852199485516325,
    0.03817599713363172,
    0.041243996903277104,
    -0.1357259898092859,
    -0.037807997161262256,
    -0.023945998202062682,
    -0.09746399268211131,
    -0.05393399595047394,
    -0.0479289964013473,
    0.025627998075773095,
    0.015184998859864775,
    0.13272299003476012,
    -0.01992499850397139,
    0.05828299562393801,
    0.003984999700794279,
    0.01369199897196368,
    -0.0586059955996862,
    -0.09657399274893518,
    -0.038770997088957336,
    0.03851899710787825,
    0.07999299399388625,
    0.030524997708091684,
    0.02518199810926011,
    -0.04238999681723199,
    0.07754099417798975,
    0.06791399490081372,
    -0.026827997985673504,
    -0.002343999824005468,
    -0.050338996220397295,
    0.07415099443252109,
    0.0205369984580206,
    -0.004803999639301309,
    0.02056399845599336,
    0.022267998328051944,
    -0.020795998438574107,
    -0.06274699528876752,
    -0.0648789951286906,
    -0.08785499340358378,
    0.023310998249740384,
    0.11212199158154483,
    -0.0858689935526986,
    0.006988999475244973,
    0.020770998440451185,
    -0.049761996263720173,
    0.010330999224317615,
    -0.05543799583754912,
    0.060666995444940156,
    -0.030032997745032517,
    0.005081999618428237,
    0.034580997403555074,
    -0.02172199836904726,
    -0.0905259932030371,
    -0.026848997984096762,
    0.03856099710472476,
    -0.00427199967924546,
    0.01161299912806122,
    -0.054601995900318494,
    0.007237999456549307,
    0.03680099723687083,
    0.0018419998616971296,
    0.09642799275989729,
    -0.010501999211478423,
    -0.05262799604853232,
    -0.08175399386166511,
    0.058220995628593154,
    -0.0029829997760274364,
    0.051125996161306975,
    0.02312999826333041,
    0.08212899383350898,
    0.06398699519566463,
    -0.01908099856734144,
    0.013841998960701232,
    0.05485299588147267,
    -0.06246999530956552,
    0.07332599449446457,
    0.061251995401016605,
    0.04967599627017731,
    -0.010154999237532223,
    0.01526999885348272,
    -0.05646399576051397,
    0.002928999780081918,
    -0.029684997771161396,
    0.004374999671511912,
    -0.024997998123075377,
    0.014342998923084653,
    0.05960199552490354,
    -0.06618599503055712,